### ISSUE TITLE
multi-NIC in the centralized gateway node,How to implement load between NIC？

### ISSUE THREAD

**Issue by wanghuiheze** [ovn-org/ovn#191]
multi-NIC in the centralized gateway node,only one NIC has traffic,How to implement load between NIC？

Experimental environment:
```
central 10.185.11.71/24 - OVN Central
gateway02 172.31.1.24/24,172.31.2.24/24 - OVN Gateway Node(it has two NIC,Configure two IPs)
node01cx5 172.31.6.150/24 – will serve as an OVN Host
client 10.79.254.0/24 - physical network node
#We use namespace instead of VM
namespace 10.199.100.10 - in node01cx5 Node

tunnel:geneve

#OVS version
[root@gateway02 ~]# ovs-vsctl -V
ovs-vsctl (Open vSwitch) 2.17.6-c5d234f
DB Schema 8.3.0
[root@node01cx5 ~]# ovs-vsctl -V
ovs-vsctl (Open vSwitch) 2.17.6-c5d234f
DB Schema 8.3.0

#OVN version
[root@newcentral ~]# ovn-nbctl -V
ovn-nbctl 22.12.0
Open vSwitch Library 3.0.90
DB Schema 7.0.0
[root@newcentral ~]# ovn-sbctl -V
ovn-sbctl 22.12.0
Open vSwitch Library 3.0.90
DB Schema 20.27.0
```

#gateway02 node IP configuration

```
[root@gateway02 ~]# ip add
1: lo: <LOOPBACK,UP,LOWER_UP> mtu 65536 qdisc noqueue state UNKNOWN group default qlen 1000
    link/loopback 00:00:00:00:00:00 brd 00:00:00:00:00:00
    inet 127.0.0.1/8 scope host lo
       valid_lft forever preferred_lft forever
2: enp8s0f0: <BROADCAST,MULTICAST,UP,LOWER_UP> mtu 1500 qdisc mq state UP group default qlen 1000
    link/ether ac:74:09:c4:7c:3d brd ff:ff:ff:ff:ff:ff
    inet 10.210.158.24/24 brd 10.210.158.255 scope global noprefixroute enp8s0f0
       valid_lft forever preferred_lft forever
3: enp8s0f1: <NO-CARRIER,BROADCAST,MULTICAST,UP> mtu 1500 qdisc mq state DOWN group default qlen 1000
    link/ether ac:74:09:c4:7c:3e brd ff:ff:ff:ff:ff:ff
4: enp8s0f2: <NO-CARRIER,BROADCAST,MULTICAST,UP> mtu 1500 qdisc mq state DOWN group default qlen 1000
    link/ether ac:74:09:c4:7c:3f brd ff:ff:ff:ff:ff:ff
5: enp8s0f3: <NO-CARRIER,BROADCAST,MULTICAST,UP> mtu 1500 qdisc mq state DOWN group default qlen 1000
    link/ether ac:74:09:c4:7c:40 brd ff:ff:ff:ff:ff:ff
6: ens1f0: <BROADCAST,MULTICAST,UP,LOWER_UP> mtu 1500 qdisc mq master ovs-system state UP group default qlen 1000
    link/ether e8:eb:d3:3a:d7:f8 brd ff:ff:ff:ff:ff:ff
    altname enp2s0f0np0
7: ens1f1: <NO-CARRIER,BROADCAST,MULTICAST,UP> mtu 1500 qdisc mq state DOWN group default qlen 1000
    link/ether e8:eb:d3:3a:d7:f9 brd ff:ff:ff:ff:ff:ff
    altname enp2s0f1np1
8: ens4f0: <BROADCAST,MULTICAST,UP,LOWER_UP> mtu 1500 qdisc mq master ovs-system state UP group default qlen 1000
    link/ether e8:eb:d3:3a:d5:e8 brd ff:ff:ff:ff:ff:ff
    altname enp129s0f0np0
9: ens4f1: <NO-CARRIER,BROADCAST,MULTICAST,UP> mtu 1500 qdisc mq state DOWN group default qlen 1000
    link/ether e8:eb:d3:3a:d5:e9 brd ff:ff:ff:ff:ff:ff
    altname enp129s0f1np1
10: ovs-system: <BROADCAST,MULTICAST> mtu 1500 qdisc noop state DOWN group default qlen 1000
    link/ether 22:42:6a:5a:87:0e brd ff:ff:ff:ff:ff:ff
11: br-ex1: <BROADCAST,MULTICAST,UP,LOWER_UP> mtu 1500 qdisc noqueue state UNKNOWN group default qlen 1000
    link/ether e8:eb:d3:3a:d7:f8 brd ff:ff:ff:ff:ff:ff
    inet 172.31.1.24/24 scope global br-ex1
       valid_lft forever preferred_lft forever
12: br-ex2: <BROADCAST,MULTICAST,UP,LOWER_UP> mtu 1500 qdisc noqueue state UNKNOWN group default qlen 1000
    link/ether e8:eb:d3:3a:d5:e8 brd ff:ff:ff:ff:ff:ff
    inet 172.31.2.24/24 scope global br-ex2
       valid_lft forever preferred_lft forever
13: br-int: <BROADCAST,MULTICAST> mtu 1500 qdisc noop state DOWN group default qlen 1000
    link/ether d6:67:54:f7:21:da brd ff:ff:ff:ff:ff:ff
24: genev_sys_6081: <BROADCAST,MULTICAST,UP,LOWER_UP> mtu 65000 qdisc noqueue master ovs-system state UNKNOWN group default qlen 1000
    link/ether e6:b1:6b:e4:8c:8c brd ff:ff:ff:ff:ff:ff
```

#In gateway02 node,multi-NIC environment, policy-based routing is used to implement network traffic inbound and outbound
```
[root@gateway02 ~]# ip route
default via 10.210.158.1 dev enp8s0f0 proto static metric 100 
10.0.0.0/8 via 172.31.1.1 dev br-ex1 
10.210.158.0/24 dev enp8s0f0 proto kernel scope link src 10.210.158.24 metric 100 
10.222.0.0/16 via 10.210.158.1 dev enp8s0f0 
10.235.0.0/16 via 10.210.158.1 dev enp8s0f0 
10.237.0.0/16 via 10.210.158.1 dev enp8s0f0 
172.16.0.0/12 via 172.31.1.1 dev br-ex1 
172.31.1.0/24 dev br-ex1 proto kernel scope link src 172.31.1.24 
172.31.2.0/24 dev br-ex2 proto kernel scope link src 172.31.2.24 
192.168.0.0/16 via 172.31.1.1 dev br-ex1 
[root@gateway02 ~]# ip route show table 101
10.0.0.0/8 via 172.31.2.1 dev br-ex2 
172.16.0.0/12 via 172.31.2.1 dev br-ex2 
192.168.0.0/16 via 172.31.2.1 dev br-ex2 
[root@gateway02 ~]# ip rule show
0:      from all lookup local
32765:  from 172.31.2.0/24 lookup 101
32766:  from all lookup main
32767:  from all lookup default
```

#The following commands are configured on gateway02 node
```
ovs-vsctl set open . external-ids:ovn-remote=tcp:10.185.11.71:6642
ovs-vsctl set open . external-ids:ovn-encap-type=geneve
ovs-vsctl set open . external-ids:ovn-encap-ip="172.31.1.24,172.31.2.24"
ovs-vsctl set Open_vSwitch . external-ids:ovn-bridge-mappings=physnet1:br-ex1,physnet2:br-ex2
```
#View ovs of gateway02
```
[root@gateway02 ~]# ovs-vsctl show 
7c16ae4f-9ad7-4626-a97c-529ff34548e8
    Bridge br-ex2
        Port patch-vbr_049e3810df847000-local-network-to-br-int
            Interface patch-vbr_049e3810df847000-local-network-to-br-int
                type: patch
                options: {peer=patch-br-int-to-vbr_049e3810df847000-local-network}
        Port br-ex2
            Interface br-ex2
                type: internal
        Port ens4f0
            Interface ens4f0
    Bridge br-ex1
        Port patch-vbr_049e380b0be47000-local-network-to-br-int
            Interface patch-vbr_049e380b0be47000-local-network-to-br-int
                type: patch
                options: {peer=patch-br-int-to-vbr_049e380b0be47000-local-network}
        Port ens1f0
            Interface ens1f0
        Port br-ex1
            Interface br-ex1
                type: internal
    Bridge br-int
        fail_mode: secure
        datapath_type: system
        Port ovn-node01-0
            Interface ovn-node01-0
                type: geneve
                options: {csum="true", key=flow, remote_ip="172.31.6.150"}
        Port br-int
            Interface br-int
                type: internal
        Port patch-br-int-to-vbr_049e3810df847000-local-network
            Interface patch-br-int-to-vbr_049e3810df847000-local-network
                type: patch
                options: {peer=patch-vbr_049e3810df847000-local-network-to-br-int}
        Port patch-br-int-to-vbr_049e380b0be47000-local-network
            Interface patch-br-int-to-vbr_049e380b0be47000-local-network
                type: patch
                options: {peer=patch-vbr_049e380b0be47000-local-network-to-br-int}
    ovs_version: "2.17.6-c5d234f"
```

#View ovs of node01cx5 node
```
[root@node01cx5 ~]# ovs-vsctl show 
e4e4929d-2ff3-425f-b99d-8433f7c7ed01
    Bridge br-int
        fail_mode: secure
        datapath_type: system
        Port ovn-gatewa-0
            Interface ovn-gatewa-0
                type: geneve
                options: {csum="true", key=flow, remote_ip="172.31.1.24"}
        Port ovn-gatewa-1
            Interface ovn-gatewa-1
                type: geneve
                options: {csum="true", key=flow, remote_ip="172.31.2.24"}
        Port enp6s0f0_0
            Interface enp6s0f0_0
        Port br-int
            Interface br-int
                type: internal
    ovs_version: "2.17.6-c5d234f"
```
#Test the reachability of tunnel endpoints on node node01cx5
```
[root@node01cx5 ~]# ping -c 1 172.31.1.24
PING 172.31.1.24 (172.31.1.24) 56(84) bytes of data.
64 bytes from 172.31.1.24: icmp_seq=1 ttl=63 time=0.120 ms

--- 172.31.1.24 ping statistics ---
1 packets transmitted, 1 received, 0% packet loss, time 0ms
rtt min/avg/max/mdev = 0.120/0.120/0.120/0.000 ms
[root@node01cx5 ~]# ping -c 1 172.31.2.24
PING 172.31.2.24 (172.31.2.24) 56(84) bytes of data.
64 bytes from 172.31.2.24: icmp_seq=1 ttl=63 time=0.545 ms

--- 172.31.2.24 ping statistics ---
1 packets transmitted, 1 received, 0% packet loss, time 0ms
rtt min/avg/max/mdev = 0.545/0.545/0.545/0.000 ms
```

#Logical topology
```
                    ____ ____ 
                   |  client |         external physical network 10.79.254.0/24
                    ---------
                  |           |
              ____|____   ____|____ 
             |  switch | |  switch |   localswitch  network_name=physnet1
              ---------   ---------                 network_name=physnet2
              ____|____   ____|____ 
             |  router | |  router |   gateway vbr_049e3810df847000
              ---------   ---------            vbr_049e380b0be47000
                    \     /
                   __\___/__
                  |  switch | joinSW       172.16.255.0/24
                   ---------          
                       |
                   ____|____ 
                  |  router | vpc_049e374424847000
                   ---------          
                       |
                   ____|____ 
                  |  switch | subnet_049e37f43f047000
                   ---------        
                       |
                   ____|____ 
                  |   vm    | vm-ip:10.199.100.10
                   --------- 
```

#View the ovn database:

```
[root@newcentral ~]# ovn-nbctl show 
switch fc840138-6341-4065-bbb4-8ff0eaf5d783 (vbr_049e3810df847000-local)
    port vbr_049e3810df847000-local-router
        type: router
        router-port: vbr_049e3810df847000-route-local
    port vbr_049e3810df847000-local-network
        type: localnet
        addresses: ["unknown"]
switch 56d9d9e6-d4b2-4ff2-8e86-59e1ac577e2c (vbr_049e380b0be47000-local)
    port vbr_049e380b0be47000-local-router
        type: router
        router-port: vbr_049e380b0be47000-route-local
    port vbr_049e380b0be47000-local-network
        type: localnet
        addresses: ["unknown"]
switch cc282dbf-88e2-4577-b32c-897a467b00da (vpc_049e374424847000-vbr)
    port vpc_049e374424847000-join-port
        type: router
        router-port: vpc_049e374424847000-vbr-port
    port ri_049e381d2ea47000
        type: router
        router-port: vbr_049e3810df847000-vpc_049e374424847000
    port ri_049e381b58a47000
        type: router
        router-port: vbr_049e380b0be47000-vpc_049e374424847000
switch d26ba833-7d1b-4991-a318-4c8658926913 (subnet_049e37f43f047000)
    port i_049e38a43f347000
        addresses: ["00:00:19:91:00:10 10.199.100.10/24"]
    port subnet_049e37f43f047000-router
        type: router
        router-port: vpc_049e374424847000-subnet_049e37f43f047000
router dbdd570c-a78b-4070-9902-64fd85ca73a0 (vpc_049e374424847000)
    port vpc_049e374424847000-subnet_049e37f43f047000
        mac: "AE:95:95:65:27:A6"
        networks: ["10.199.100.1/24"]
        route-table: vtb_049e374424847000
    port vpc_049e374424847000-vbr-port
        mac: "AE:88:88:F2:DB:46"
        networks: ["172.16.255.2/24"]
router ea703286-75f5-4192-b30e-e7d4507d188b (vbr_049e3810df847000)
    port vbr_049e3810df847000-route-local
        mac: "AE:7D:7D:2E:44:9F"
        networks: ["172.31.2.240/24"]
    port vbr_049e3810df847000-vpc_049e374424847000
        mac: "AE:95:95:B8:53:42"
        networks: ["172.16.255.4/24"]
router 2511a303-db19-4eac-b34d-6c6fed89890c (vbr_049e380b0be47000)
    port vbr_049e380b0be47000-vpc_049e374424847000
        mac: "AE:B5:B5:10:8D:04"
        networks: ["172.16.255.3/24"]
    port vbr_049e380b0be47000-route-local
        mac: "AE:CF:CF:9E:66:B2"
        networks: ["172.31.1.240/24"]


[root@newcentral ~]# ovn-sbctl show 
Chassis node01cx5
    hostname: node01cx5
    Encap geneve
        ip: "172.31.6.150"
        options: {csum="true"}
    Port_Binding i_049e38a43f347000
Chassis gateway02
    hostname: gateway02
    Encap geneve
        ip: "172.31.1.24"
        options: {csum="true"}
    Encap geneve
        ip: "172.31.2.24"
        options: {csum="true"}
    Port_Binding vbr_049e380b0be47000-route-local
    Port_Binding ri_049e381d2ea47000
    Port_Binding vbr_049e3810df847000-vpc_049e374424847000
    Port_Binding vbr_049e3810df847000-local-router
    Port_Binding ri_049e381b58a47000
    Port_Binding vbr_049e3810df847000-route-local
    Port_Binding vbr_049e380b0be47000-vpc_049e374424847000
    Port_Binding vbr_049e380b0be47000-local-router
```

**There are two NIC on the gateway02 node, Two ip addresses are configured, Two gateway logical routers are created in ovn are binding to gateway02 chassis.In gateway02 node configure mapping two physical network names to two ovs bridges.**

```
#vm(10.199.100.10) -> client(10.79.254.0/24)
[root@node01cx5 ~]# ip netns exec sw1-vm1 fping -g 10.79.254.0/24

#Capture packets on node01cx5
[root@node01cx5 ~]# tcpdump -nni enp6s0f0  port 6081
dropped privs to tcpdump
tcpdump: verbose output suppressed, use -v or -vv for full protocol decode
listening on enp6s0f0, link-type EN10MB (Ethernet), capture size 262144 bytes
23:09:16.528879 IP 172.31.6.150.56259 > 172.31.1.24.6081: Geneve, Flags [C], vni 0x1, options [8 bytes]: IP 10.199.100.10 > 10.79.254.62: ICMP echo request, id 55319, seq 1, length 64
23:09:16.530777 IP 172.31.1.24.34679 > 172.31.6.150.6081: Geneve, Flags [C], vni 0x3, options [8 bytes]: IP 10.79.254.62 > 10.199.100.10: ICMP echo reply, id 55319, seq 1, length 64
23:09:17.818678 IP 172.31.6.150.17026 > 172.31.1.24.6081: Geneve, Flags [C], vni 0x1, options [8 bytes]: IP 10.199.100.10 > 10.79.254.63: ICMP echo request, id 55320, seq 1, length 64
23:09:17.820297 IP 172.31.1.24.6047 > 172.31.6.150.6081: Geneve, Flags [C], vni 0x3, options [8 bytes]: IP 10.79.254.63 > 10.199.100.10: ICMP echo reply, id 55320, seq 1, length 64
23:09:18.762650 IP 172.31.6.150.44395 > 172.31.1.24.6081: Geneve, Flags [C], vni 0x1, options [8 bytes]: IP 10.199.100.10 > 10.79.254.64: ICMP echo request, id 55321, seq 1, length 64
23:09:18.763774 IP 172.31.1.24.9061 > 172.31.6.150.6081: Geneve, Flags [C], vni 0x3, options [8 bytes]: IP 10.79.254.64 > 10.199.100.10: ICMP echo reply, id 55321, seq 1, length 64
23:09:19.675662 IP 172.31.6.150.34091 > 172.31.1.24.6081: Geneve, Flags [C], vni 0x1, options [8 bytes]: IP 10.199.100.10 > 10.79.254.65: ICMP echo request, id 55322, seq 1, length 64
23:09:19.677182 IP 172.31.1.24.56947 > 172.31.6.150.6081: Geneve, Flags [C], vni 0x3, options [8 bytes]: IP 10.79.254.65 > 10.199.100.10: ICMP echo reply, id 55322, seq 1, length 64
23:09:20.586671 IP 172.31.6.150.40965 > 172.31.1.24.6081: Geneve, Flags [C], vni 0x1, options [8 bytes]: IP 10.199.100.10 > 10.79.254.66: ICMP echo request, id 55323, seq 1, length 64
23:09:20.588241 IP 172.31.1.24.686 > 172.31.6.150.6081: Geneve, Flags [C], vni 0x3, options [8 bytes]: IP 10.79.254.66 > 10.199.100.10: ICMP echo reply, id 55323, seq 1, length 64
23:09:21.439666 IP 172.31.6.150.35020 > 172.31.1.24.6081: Geneve, Flags [C], vni 0x1, options [8 bytes]: IP 10.199.100.10 > 10.79.254.67: ICMP echo request, id 55324, seq 1, length 64
23:09:21.441271 IP 172.31.1.24.38066 > 172.31.6.150.6081: Geneve, Flags [C], vni 0x3, options [8 bytes]: IP 10.79.254.67 > 10.199.100.10: ICMP echo reply, id 55324, seq 1, length 64
```

**Cording to packet capture, the destination address of the tunnel is always 172.31.1.24,As a result, the usage of the two NIC on the gateway02 node is inconsistent,The traffic pressure is all on the NIC whose IP address is 172.31.1.24,This includes the traffic from the gateway02 node.**
**I want to load balance traffic by changing destination addresses,but it didn't happen.I believe that the destination address of the vm accessing the external tunnel must be 172.31.1.24 or 172.31.2.24,But the truth is there's only 172.31.1.24**

#I check the flow table of node01cx5 node as follows
```
[root@node01cx5 ~]# ovs-ofctl dump-ports-desc br-int
OFPST_PORT_DESC reply (xid=0x2):
 64(enp6s0f0_0): addr:86:b0:98:38:2e:af
     config:     0
     state:      0
     current:    FIBER AUTO_NEG
     advertised: 1GB-FD 10GB-FD FIBER AUTO_NEG AUTO_PAUSE
     supported:  1GB-FD 10GB-FD FIBER AUTO_NEG AUTO_PAUSE
     speed: 0 Mbps now, 10000 Mbps max
 77(ovn-gatewa-0): addr:ce:1d:20:d4:42:76
     config:     0
     state:      0
     speed: 0 Mbps now, 0 Mbps max
 78(ovn-gatewa-1): addr:06:5f:68:8c:a3:64
     config:     0
     state:      0
     speed: 0 Mbps now, 0 Mbps max
 LOCAL(br-int): addr:72:c6:65:df:24:61
     config:     PORT_DOWN
     state:      LINK_DOWN
     speed: 0 Mbps now, 0 Mbps max

[root@node01cx5 ~]# ovs-dpctl show
system@ovs-system:
  lookups: hit:49372 missed:1422 lost:0
  flows: 0
  masks: hit:74074 total:0 hit/pkt:1.46
  cache: hit:13975 hit-rate:27.51%
  caches:
    masks-cache: size:256
  port 0: ovs-system (internal)
  port 1: br-int (internal)
  port 2: genev_sys_6081 (geneve: packet_type=ptap)
  port 3: enp6s0f0_0

[root@node01cx5 ~]# ovs-ofctl dump-flows br-int | grep output:77
 cookie=0x784980c0, duration=7744.795s, table=37, n_packets=533, n_bytes=52210, idle_age=1171, priority=100,reg15=0x3,metadata=0x1 actions=load:0x1->NXM_NX_TUN_ID[0..23],set_field:0x3->tun_metadata0,move:NXM_NX_REG14[0..14]->NXM_NX_TUN_METADATA0[16..30],output:77,resubmit(,38)
 cookie=0xfdc29ca4, duration=7744.795s, table=37, n_packets=600, n_bytes=58800, idle_age=1168, priority=100,reg15=0x2,metadata=0x1 actions=load:0x1->NXM_NX_TUN_ID[0..23],set_field:0x2->tun_metadata0,move:NXM_NX_REG14[0..14]->NXM_NX_TUN_METADATA0[16..30],output:77,resubmit(,38)
 cookie=0x778931c, duration=7744.795s, table=37, n_packets=0, n_bytes=0, idle_age=7744, priority=100,reg15=0x8000,metadata=0x1 actions=load:0x1->NXM_NX_REG15[],resubmit(,39),load:0x8000->NXM_NX_REG15[],load:0x1->NXM_NX_TUN_ID[0..23],set_field:0x8000->tun_metadata0,move:NXM_NX_REG14[0..14]->NXM_NX_TUN_METADATA0[16..30],output:77
[root@node01cx5 ~]# ovs-ofctl dump-flows br-int | grep output:78
[root@node01cx5 ~]# 
```
Display in the flow table,The outgoing interface is only 77(ovn-gatewa-0),no 78(ovn-gatewa-1).

**In the ovn centralized gateway,The gateway node has multi-NIC,Without making a bond.What do I need to do?If more information is needed, I will be happy to provide it.**

**If multi-NIC are bonded,hardware offload may occur?**

**Comment by wanghuiheze** [comment]
logical router:vpc_049e374424847000 The route entries are as follows
```
[root@newcentral ~]# ovn-nbctl lr-route-list vpc_049e374424847000
IPv4 Routes
Route Table vtb_049e374424847000:
                0.0.0.0/0              172.16.255.3 dst-ip ecmp
                0.0.0.0/0              172.16.255.4 dst-ip ecmp
```

**Comment by wanghuiheze** [comment]
@marceloleitner @hzhou8 Could you help me with this question? Thank you!

**Comment by marceloleitner** [comment]
I have no idea @wanghuiheze . My knowledge on OVN is limited to HWOL matter. :-(

**Comment by hzhou8** [comment]
Hi @wanghuiheze , I see you have two ECMP routes but both next hop logical router ports are on the same gateway chassis, and there is no relationship between the tunnel endpoints and the logical router ports, so when traffic is transferred to the gateway chassis it just picks the first tunnel endpoint of that chassis, and no load-sharing will happen. The load-sharing of multiple NIC in your case is an underlay problem instead of overlay. You can use NIC bonding, or, you can keep the multiple encap endpoints and define underlay network routes/policies so that different traffic will get into the node through different interfaces (for example, define policy routing in the "host" side in your topology, or some load-sharing rules on switches, or other underlay approaches).

**Comment by hzhou8** [comment]
It is possible for OVN to implement a feature so that when there are multiple encaps that can reach the same chassis, select the encaps using OVS dp hash for load-balancing, but this feature doesn't not exist today.

**Comment by wanghuiheze** [comment]
> It is possible for OVN to implement a feature so that when there are multiple encaps that can reach the same chassis, select the encaps using OVS dp hash for load-balancing, but this feature doesn't not exist today.

I'm looking forward to this feature.This enables multiple centralized gateway servers to be consolidated into one centralized gateway server with multiple network cards, thus saving rack costs.
I use OVN Release 23.03.0 new Feature "Support for running multiple instances of ovn-controller on the same hypervisor has been added as an experimental feature."Two virtual Chassis were virtualized in one chassis, which realized my requirements. However, this feature is an experimental feature with some limitations. We only conducted tests and did not use it in production environment.
Thank you for your answer!

**Comment by wanghuiheze** [comment]
> 

I have one 
more proposition and one more question:

1. I see in 

OVN v20.03.0 - 04 Feb 2020
--------------------------
   - ……
   - Added support for ECMP routes in OVN router.

OVN v20.06.0
--------------------------
   - ……
   - Added support to choose selection methods - dp_hash or
     hash (with specified hash fields) for OVN load balancer
     backend selection. This is incompatible with older versions.
     Care should be taken while upgrading as the existing
     load balancer traffic will be affected if ovn-controllers
     are not stopped before uprading northd services.

When I added an ecmp route (two equivalent default routes in a distributed LR with the next hop pointing to two centralized gateways)

```
ovn-nbctl --ecmp lr-route-add vRouter1 "0.0.0.0/0" 172.16.255.30
ovn-nbctl --ecmp lr-route-add vRouter1 "0.0.0.0/0" 172.16.255.20
```


View group description in node

```
[root@node02 ~]# ovs-ofctl dump-groups br-int
NXST_GROUP_DESC reply (xid=0x2):
 group_id=1,type=select,selection_method=dp_hash,bucket=bucket_id:0,weight:100,actions=load:0x1->OXM_OF_PKT_REG4[48..63],resubmit(,22),bucket=bucket_id:1,weight:100,actions=load:0x2->OXM_OF_PKT_REG4[48..63],resubmit(,22)
[root@node02 ~]# 
```

I found that ecmp hash mode is dp_hash.However,hash mode hardware offload for dp_hash is not supported.When I open the debug log of netdev_offload_tc, the log is displayed as follows:

```
[root@node02 ~]# ovs-appctl vlog/set netdev_offload_tc:file:dbg
[root@node02 ~]# tail -f /var/log/openvswitch/ovs-vswitchd.log
2023-05-23T11:01:04.214Z|31737|netdev_offload_tc(handler9)|DBG|offloading attribute dp_hash isn't supported
2023-05-23T11:01:04.241Z|31738|netdev_offload_tc(handler9)|DBG|offloading attribute dp_hash isn't supported
2023-05-23T11:01:06.567Z|32039|netdev_offload_tc(handler8)|DBG|Dropped 3084 log messages in last 12 seconds (most recently, 1 seconds ago) due to excessive rate
2023-05-23T11:01:06.567Z|32040|netdev_offload_tc(handler8)|DBG|vlan_id[0]: 3178

```


I'm not sure if this is not supported by hardware or software.Later I changed the hash mode of ECMP to selection_method=hash and the hardware offload normally


    struct ofpact_group *og;

    struct ds ds = DS_EMPTY_INITIALIZER;
    - ds_put_format(&ds, "type=select,selection_method=dp_hash");
    + ds_put_format(&ds, "type=select,selection_method=hash,fields(ip_src,ip_dst)");

    struct mf_subfield sf = expr_resolve_field(&select->res_field);

**This method is too crude, can it be made into a parameter in a way similar to load balance select hash mode?**



2. When I use a centralized gateway, I use VM to send ICMP packets,

ovn internal <-> ovn internal (10.199.100.10<->10.199.100.20)
```
[root@node01 ~]# ip netns exec sw1-vm1 ping 10.199.100.20
PING 10.199.100.20 (10.199.100.20) 56(84) bytes of data.
64 bytes from 10.199.100.20: icmp_seq=1 ttl=64 time=5.00 ms
64 bytes from 10.199.100.20: icmp_seq=2 ttl=64 time=0.047 ms
64 bytes from 10.199.100.20: icmp_seq=3 ttl=64 time=0.042 ms
64 bytes from 10.199.100.20: icmp_seq=4 ttl=64 time=0.037 ms
64 bytes from 10.199.100.20: icmp_seq=5 ttl=64 time=0.035 ms
64 bytes from 10.199.100.20: icmp_seq=6 ttl=64 time=0.038 ms
64 bytes from 10.199.100.20: icmp_seq=7 ttl=64 time=0.036 ms
64 bytes from 10.199.100.20: icmp_seq=8 ttl=64 time=0.036 ms
64 bytes from 10.199.100.20: icmp_seq=9 ttl=64 time=0.038 ms
^C
--- 10.199.100.20 ping statistics ---
9 packets transmitted, 9 received, 0% packet loss, time 8161ms
rtt min/avg/max/mdev = 0.035/0.590/5.001/1.559 ms
```
```
[root@node01 ~]# ovs-appctl dpctl/dump-flows -m
ufid:9a26ef91-71ca-40b9-ac83-a71f310b99b5, skb_priority(0/0),tunnel(tun_id=0x9,src=172.31.2.22,dst=172.31.1.21,ttl=0/0,tp_dst=6081,geneve({class=0x102,type=0x80,len=4,0x30002/0x7fffffff}),flags(+key)),skb_mark(0/0),ct_state(0/0),ct_zone(0/0),ct_mark(0/0),ct_label(0/0),recirc_id(0),dp_hash(0/0),in_port(genev_sys_6081),packet_type(ns=0/0,id=0/0),eth(src=00:00:19:91:00:20,dst=00:00:19:91:00:10),eth_type(0x0800),ipv4(src=0.0.0.0/0.0.0.0,dst=10.199.100.10,proto=0/0,tos=0/0,ttl=0/0,frag=no), packets:8, bytes:784, used:1.160s, offloaded:yes, dp:tc, actions:enp6s0f0_0
ufid:735dbfe2-12ba-4aa6-b88f-e7975855ef2a, skb_priority(0/0),skb_mark(0/0),ct_state(0/0),ct_zone(0/0),ct_mark(0/0),ct_label(0/0),recirc_id(0),dp_hash(0/0),in_port(enp6s0f0_0),packet_type(ns=0/0,id=0/0),eth(src=00:00:19:91:00:10,dst=00:00:19:91:00:20),eth_type(0x0800),ipv4(src=10.199.100.10,dst=10.199.100.16/255.255.255.240,proto=0/0,tos=0/0x3,ttl=0/0,frag=no), packets:8, bytes:784, used:1.160s, offloaded:yes, dp:tc, actions:set(tunnel(tun_id=0x9,dst=172.31.2.22,ttl=64,tp_dst=6081,geneve({class=0x102,type=0x80,len=4,0x20003}),flags(csum|key))),genev_sys_6081
ufid:fda13309-ca39-41c8-aee3-d53e7c36cd2a, recirc_id(0),dp_hash(0/0),skb_priority(0/0),in_port(enp6s0f0_0),skb_mark(0/0),ct_state(0/0),ct_zone(0/0),ct_mark(0/0),ct_label(0/0),eth(src=00:00:19:91:00:10,dst=00:00:19:91:00:20),eth_type(0x0806),arp(sip=10.199.100.10,tip=10.199.100.20,op=1/0xff,sha=00:00:19:91:00:10,tha=00:00:00:00:00:00), packets:0, bytes:0, used:never, dp:ovs, actions:userspace(pid=4294967295,slow_path(action))
```
```
[root@node01 ~]# ovs-appctl dpctl/dump-flows type=offloaded  
tunnel(tun_id=0x9,src=172.31.2.22,dst=172.31.1.21,tp_dst=6081,geneve({class=0x102,type=0x80,len=4,0x30002/0x7fffffff}),flags(+key)),recirc_id(0),in_port(2),eth(src=00:00:19:91:00:20,dst=00:00:19:91:00:10),eth_type(0x0800),ipv4(dst=10.199.100.10,frag=no), packets:8, bytes:784, used:3.380s, actions:3
recirc_id(0),in_port(3),eth(src=00:00:19:91:00:10,dst=00:00:19:91:00:20),eth_type(0x0800),ipv4(src=10.199.100.10,dst=10.199.100.16/255.255.255.240,tos=0/0x3,frag=no), packets:8, bytes:784, used:3.380s, actions:set(tunnel(tun_id=0x9,dst=172.31.2.22,ttl=64,tp_dst=6081,geneve({class=0x102,type=0x80,len=4,0x20003}),flags(csum|key))),2
[root@node01 ~]# 
```


**You can see that the hardware offload properly.**




ovn internal <-> ovn external (10.199.100.10<->172.16.153.11)
```
[root@node01 ~]# ip netns exec sw1-vm1 ping 172.16.153.11
PING 172.16.153.11 (172.16.153.11) 56(84) bytes of data.
64 bytes from 172.16.153.11: icmp_seq=1 ttl=55 time=5.02 ms
64 bytes from 172.16.153.11: icmp_seq=2 ttl=55 time=0.700 ms
64 bytes from 172.16.153.11: icmp_seq=3 ttl=55 time=0.689 ms
^C
--- 172.16.153.11 ping statistics ---
3 packets transmitted, 3 received, 0% packet loss, time 2046ms
rtt min/avg/max/mdev = 0.689/2.135/5.017/2.038 ms
```
```
[root@node01 ~]# ovs-appctl dpctl/dump-flows -m
ufid:28738cd0-92c9-4f48-bea0-d09dbfd2274f, skb_priority(0/0),tunnel(tun_id=0x9,src=172.31.5.23,dst=172.31.1.21,ttl=0/0,tp_dst=6081,geneve({class=0x102,type=0x80,len=4,0x10002/0x7fffffff}),flags(+key)),skb_mark(0/0),ct_state(0/0),ct_zone(0/0),ct_mark(0/0),ct_label(0/0),recirc_id(0),dp_hash(0/0),in_port(genev_sys_6081),packet_type(ns=0/0,id=0/0),eth(src=ae:95:95:65:27:a6,dst=00:00:19:91:00:10),eth_type(0x0800),ipv4(src=0.0.0.0/0.0.0.0,dst=10.199.100.10,proto=0/0,tos=0/0,ttl=0/0,frag=no), packets:2, bytes:196, used:0.610s, offloaded:yes, dp:tc, actions:enp6s0f0_0
ufid:c7753b6b-709e-43eb-ab8b-7497ec9ad13c, skb_priority(0/0),skb_mark(0/0),ct_state(0/0x30),ct_zone(0/0),ct_mark(0/0),ct_label(0/0),recirc_id(0),dp_hash(0/0),in_port(enp6s0f0_0),packet_type(ns=0/0,id=0/0),eth(src=00:00:19:91:00:10,dst=ae:95:95:65:27:a6),eth_type(0x0800),ipv4(src=10.199.100.10,dst=172.16.153.11,proto=1,tos=0/0x3,ttl=64,frag=no),icmp(type=8/0xf8,code=0/0), packets:2, bytes:168, used:1.630s, dp:tc, actions:set(tunnel(tun_id=0x1,dst=172.31.6.24,ttl=64,tp_dst=6081,geneve({class=0x102,type=0x80,len=4,0x10003}),flags(csum|key))),set(eth(src=ae:b4:b4:34:2d:0e,dst=ae:21:21:80:78:a6)),set(ipv4(ttl=63)),genev_sys_6081
```
```
[root@node01 ~]# ovs-appctl dpctl/dump-flows type=offloaded  
tunnel(tun_id=0x9,src=172.31.5.23,dst=172.31.1.21,tp_dst=6081,geneve({class=0x102,type=0x80,len=4,0x10002/0x7fffffff}),flags(+key)),recirc_id(0),in_port(2),eth(src=ae:95:95:65:27:a6,dst=00:00:19:91:00:10),eth_type(0x0800),ipv4(dst=10.199.100.10,frag=no), packets:2, bytes:196, used:2.200s, actions:3
[root@node01 ~]# 
```




when ovn internal <-> ovn external hardware offload exception,and there's no exception log.Please help us to see how to solve this , thanks.@marceloleitner 
```
[root@node01 ~]# ovs-vsctl -V
ovs-vsctl (Open vSwitch) 2.17.6
DB Schema 8.3.0
[root@node01 ~]# ovs-ofctl -V
ovs-ofctl (Open vSwitch) 2.17.6
OpenFlow versions 0x1:0x6
[root@node01 ~]# ovn-controller --version
ovn-controller 23.03.1
Open vSwitch Library 3.1.0
OpenFlow versions 0x6:0x6
SB DB Schema 20.27.0
```
```
[root@newcentral ~]# ovn-nbctl --version
ovn-nbctl 23.03.1
Open vSwitch Library 3.1.0
DB Schema 7.0.0
[root@newcentral ~]# ovn-sbctl --version
ovn-sbctl 23.03.1
Open vSwitch Library 3.1.0
DB Schema 20.27.0
```

**Comment by almusil** [comment]
Hi,

this issue has been inactive for more than 6 months, closing it as stale. In case the issue still persists with recent version of OVN please feel free to re-open it with info from new version.

Thanks,
Ales
